{
  "schema_version": "1.0",
  "record_type": "memory_query",
  "tenant_id": "018f0000-0000-7000-8000-000000000001",
  "query_id": "018f0000-0000-7000-8000-00000000000a",
  "scope": {
    "schema_version": "1.0",
    "record_type": "memory_scope",
    "scope_id": "018f0000-0000-7000-8000-000000000005",
    "tenant_id": "018f0000-0000-7000-8000-000000000001",
    "actor_id": "018f0000-0000-7000-8000-000000000002",
    "parent_record_type": "actor_context",
    "parent_digest": "sha256:eaa0f1c67d60a24074f87d824ec6267bf04ca492ff330844c17ee715e4fa08df",
    "selection": {
      "level": "project",
      "project_id": "018f0000-0000-7000-8000-00000000002e"
    },
    "derived_at": "2026-01-01T00:00:02.000Z",
    "valid_until": "2026-01-01T01:00:00.000Z"
  },
  "query": "synthetic fixture query",
  "retrieval_profile": "fast",
  "budget": {
    "max_records": 10,
    "timeout_ms": 1000
  },
  "allowed_categories": [
    "fact"
  ],
  "temporal_bound": {
    "from": "2025-01-01T00:00:00.000Z",
    "until": "2026-01-01T00:00:00.000Z"
  },
  "correlation_id": "018f0000-0000-7000-8000-000000000004",
  "idempotency": {
    "tenant_id": "018f0000-0000-7000-8000-000000000001",
    "idempotency_key": "fixture.operation.0003",
    "operation_digest": "sha256:6cad2a624f4138ed269aa3f6c11e954b497a9baaaeb7aadedc236e674ee88306"
  }
}
